{
  "id": "base:jungle",
  "description": "Hot, wet rainforest.",
  "climate": {
    "temperature": {
      "center": 0.7,
      "extent": 0.35
    },
    "humidity": {
      "center": 0.6,
      "extent": 0.4
    },
    "height": [
      0,
      110
    ]
  },
  "surface": [
    {
      "block": "base:clay",
      "when": {
        "river_min": 0.55,
        "patch": {
          "noise": "b",
          "lo": 0.3,
          "hi": 2
        }
      }
    },
    {
      "block": "base:gravel",
      "when": {
        "river_min": 0.55
      }
    },
    {
      "block": "base:mud",
      "when": {
        "river_min": 0.4
      }
    },
    {
      "block": "base:andesite",
      "when": {
        "slope_min": 5,
        "patch": {
          "noise": "a",
          "lo": 0.25,
          "hi": 2
        }
      }
    },
    {
      "block": "base:granite",
      "when": {
        "slope_min": 5,
        "patch": {
          "noise": "a",
          "lo": -2,
          "hi": -0.25
        }
      }
    },
    {
      "block": "base:stone",
      "when": {
        "slope_min": 5
      }
    },
    {
      "block": "base:moss_block",
      "when": {
        "patch": {
          "noise": "a",
          "lo": 0.4,
          "hi": 2
        }
      }
    },
    {
      "block": "base:podzol",
      "when": {
        "patch": {
          "noise": "b",
          "lo": 0.5,
          "hi": 2
        }
      }
    },
    {
      "block": "base:grass_block"
    },
    {
      "block": "base:dirt",
      "depth": 3
    }
  ],
  "plants": [
    {
      "block": "base:fern",
      "chance": 12,
      "on": [
        "base:grass_block",
        "base:podzol",
        "base:moss_block"
      ]
    },
    {
      "block": "base:tall_grass",
      "chance": 16,
      "on": [
        "base:grass_block",
        "base:podzol",
        "base:moss_block"
      ]
    },
    {
      "block": "base:mushroom",
      "chance": 3,
      "on": [
        "base:grass_block",
        "base:podzol",
        "base:moss_block"
      ]
    },
    {
      "block": "base:flower_red",
      "chance": 2,
      "on": [
        "base:grass_block",
        "base:podzol",
        "base:moss_block"
      ]
    }
  ],
  "tree_density_scale": 1.6,
  "features": [
    {
      "id": "base:jungle_boulder",
      "block": "base:mossy_cobble_warm",
      "chance_per_mille": 5,
      "radius": 1
    },
    {
      "id": "base:jungle_moss",
      "block": "base:moss_block",
      "chance_per_mille": 6,
      "radius": 2
    }
  ]
}
